{
  "schema_version": 1,
  "artifact_id": "nested-strategy-tag-map",
  "as_of_date": "2026-10-26",
  "parents": [
    {
      "parent_account_id": "account-1b44c987969b9e47",
      "provider_id": "ibkr",
      "tag_field": "orderReference",
      "tag_normalization": "STRIP_LEADING_DIGITS_AND_DASH",
      "sleeves": [
        {
          "sleeve_id": "s1",
          "strategy_id": "p123-conn-1911998-andreas-sc-ai-mq-live",
          "label": "P123 connection 1911998 (owner live book 1911997, Andreas SC AI+MQ Live)",
          "effective_start": "2026-01-26",
          "effective_end": "2026-06-23",
          "tags": [
            {
              "match": "startswith",
              "pattern": "BasedonAndreasSCAIMQLive"
            }
          ]
        },
        {
          "sleeve_id": "s2",
          "strategy_id": "p123-ai-factor",
          "label": "P123 connection 1913284 (book 1853536, AI Factor Small and Micro Cap Index 125)",
          "effective_start": "2026-01-30",
          "effective_end": null,
          "tags": [
            {
              "match": "startswith",
              "pattern": "AndreasAIFactorSnMCIndex125Sto"
            }
          ]
        },
        {
          "sleeve_id": "s3",
          "strategy_id": "p123-conn-1951348-higher-beta-earnings",
          "label": "P123 connection 1951348 (designer model 1765750, Higher Beta + Earnings)",
          "effective_start": "2026-06-22",
          "effective_end": "2026-07-22",
          "tags": [
            {
              "match": "startswith",
              "pattern": "BasedonHigherBeta"
            }
          ]
        },
        {
          "sleeve_id": "s4",
          "strategy_id": "p123-conn-1956961-ai-largecap-ls",
          "label": "P123 connection 1956961 (book 1906462, AI Large Cap Long-Short TWM 25%)",
          "effective_start": "2026-07-15",
          "effective_end": "2026-07-27",
          "tags": [
            {
              "match": "startswith",
              "pattern": "BasedonAILargeCapStrategyBookL"
            }
          ]
        },
        {
          "sleeve_id": "s5",
          "strategy_id": "p123-conn-1958970-high-octane",
          "label": "P123 connection 1958970 (High Octane Microcaps; Yuval Taylor stream 07-22 and connection stream 07-24)",
          "effective_start": "2026-07-22",
          "effective_end": "2026-07-27",
          "tags": [
            {
              "match": "contains",
              "pattern": "HighOctaneMicrocapsYuvalTaylor"
            },
            {
              "match": "contains",
              "pattern": "BasedonHighOctaneMicrocapsCopy"
            }
          ]
        }
      ],
      "unmatched": {
        "mode": "ASSIGN_BY_HOLDING_SYMBOL",
        "fallback_sleeve_id": "s4"
      }
    },
    {
      "parent_account_id": "account-58e75e8d952fa1b8",
      "provider_id": "quantbase",
      "tag_field": "fund_id",
      "tag_normalization": "NONE",
      "sleeves": [
        {
          "sleeve_id": "crisis",
          "strategy_id": "quantbase-crisis-factor-investing",
          "label": "Crisis Factor Investing",
          "effective_start": "2024-07-24",
          "effective_end": "2024-12-12",
          "tags": [
            {
              "match": "exact",
              "pattern": "56"
            }
          ]
        },
        {
          "sleeve_id": "singleindex",
          "strategy_id": "quantbase-single-index-leveraged-in-out",
          "label": "Single-Index Leveraged In & Out",
          "effective_start": "2024-07-24",
          "effective_end": "2025-05-05",
          "tags": [
            {
              "match": "exact",
              "pattern": "14"
            }
          ]
        }
      ],
      "unmatched": {
        "mode": "BLOCK"
      }
    }
  ]
}
